{"schema": "yuho.model-bundle/v1", "canonical_profile": "yuho.sorted-json/v1", "hash_algorithm": "sha256", "model_id": "model:synthetic", "artifacts": [{"sha256": "2408d0a51cd717a8734137f246be3eb4331a9955a312fd24ce5a778393c27821", "byte_length": 1493, "media_type": "application/json", "role": "executable_model"}, {"sha256": "a8cdd76642f0ecda0067f4d780d027935959e42dc16520220f295191b913efba", "byte_length": 16, "media_type": "text/plain; charset=utf-8", "role": "source_text"}], "legal_sources": [{"source_id": "src:main", "work_id": "work:synthetic", "expression_id": "expression:synthetic:1", "manifestation_id": "manifestation:text:1", "artifact_digest": "a8cdd76642f0ecda0067f4d780d027935959e42dc16520220f295191b913efba", "source_type": "synthetic", "language": "en", "jurisdiction": "SYN", "identifiers": [], "dates": {}, "publisher_label": "synthetic fixture author", "locator": "fixture:synthetic:1"}], "derivations": [], "semantic_mappings": [{"semantic_id": "f:root", "artifact_digest": "a8cdd76642f0ecda0067f4d780d027935959e42dc16520220f295191b913efba", "source_id": "src:main", "role": "supporting_context", "span": {"start": 0, "end": 1, "start_line": 1, "start_col": 1, "end_line": 1, "end_col": 2}}, {"semantic_id": "p:root", "artifact_digest": "a8cdd76642f0ecda0067f4d780d027935959e42dc16520220f295191b913efba", "source_id": "src:main", "role": "supporting_context", "span": {"start": 0, "end": 1, "start_line": 1, "start_col": 1, "end_line": 1, "end_col": 2}}, {"semantic_id": "pen:root:1", "artifact_digest": "a8cdd76642f0ecda0067f4d780d027935959e42dc16520220f295191b913efba", "source_id": "src:main", "role": "supporting_context", "span": {"start": 0, "end": 1, "start_line": 1, "start_col": 1, "end_line": 1, "end_col": 2}}, {"semantic_id": "r:root", "artifact_digest": "a8cdd76642f0ecda0067f4d780d027935959e42dc16520220f295191b913efba", "source_id": "src:main", "role": "supporting_context", "span": {"start": 0, "end": 1, "start_line": 1, "start_col": 1, "end_line": 1, "end_col": 2}}, {"semantic_id": "term:fixture", "artifact_digest": "a8cdd76642f0ecda0067f4d780d027935959e42dc16520220f295191b913efba", "source_id": "src:main", "role": "supporting_context", "span": {"start": 0, "end": 1, "start_line": 1, "start_col": 1, "end_line": 1, "end_col": 2}}], "scope": {"coverage_mode": "enumerated_only", "semantic_ids": ["f:root", "p:root", "pen:root:1", "r:root", "term:fixture"], "source_ids": ["src:main"], "expression_ids": ["expression:synthetic:1"], "exclusions": [], "limitations": ["synthetic technical fixture"], "unsupported_capabilities": [], "jurisdictions": ["SYN"], "subject_matters": ["synthetic"], "temporal_context": {"kind": "unspecified"}}, "executable_model": {"artifact_digest": "2408d0a51cd717a8734137f246be3eb4331a9955a312fd24ce5a778393c27821", "format": "yuho.kernel-input/v1", "fragment": "RegisteredPresumptionDerivations-v1"}}