{"artifacts":[{"byte_length":1493,"media_type":"application/json","role":"executable_model","sha256":"2408d0a51cd717a8734137f246be3eb4331a9955a312fd24ce5a778393c27821"},{"byte_length":1493,"media_type":"application/json","role":"executable_model","sha256":"2408d0a51cd717a8734137f246be3eb4331a9955a312fd24ce5a778393c27821"},{"byte_length":16,"media_type":"text/plain; charset=utf-8","role":"source_text","sha256":"a8cdd76642f0ecda0067f4d780d027935959e42dc16520220f295191b913efba"}],"canonical_profile":"yuho.sorted-json/v1","derivations":[],"executable_model":{"artifact_digest":"2408d0a51cd717a8734137f246be3eb4331a9955a312fd24ce5a778393c27821","format":"yuho.kernel-input/v1","fragment":"RegisteredPresumptionDerivations-v1"},"hash_algorithm":"sha256","legal_sources":[{"artifact_digest":"a8cdd76642f0ecda0067f4d780d027935959e42dc16520220f295191b913efba","dates":{},"expression_id":"expression:synthetic:1","identifiers":[],"jurisdiction":"SYN","language":"en","locator":"fixture:synthetic:1","manifestation_id":"manifestation:text:1","publisher_label":"synthetic fixture author","source_id":"src:main","source_type":"synthetic","work_id":"work:synthetic"}],"model_id":"model:synthetic","schema":"yuho.model-bundle/v1","scope":{"coverage_mode":"enumerated_only","exclusions":[],"expression_ids":["expression:synthetic:1"],"jurisdictions":["SYN"],"limitations":["synthetic technical fixture"],"semantic_ids":["f:root","p:root","pen:root:1","r:root","term:fixture"],"source_ids":["src:main"],"subject_matters":["synthetic"],"temporal_context":{"kind":"unspecified"},"unsupported_capabilities":[]},"semantic_mappings":[{"artifact_digest":"a8cdd76642f0ecda0067f4d780d027935959e42dc16520220f295191b913efba","role":"supporting_context","semantic_id":"f:root","source_id":"src:main","span":{"end":1,"end_col":2,"end_line":1,"start":0,"start_col":1,"start_line":1}},{"artifact_digest":"a8cdd76642f0ecda0067f4d780d027935959e42dc16520220f295191b913efba","role":"supporting_context","semantic_id":"p:root","source_id":"src:main","span":{"end":1,"end_col":2,"end_line":1,"start":0,"start_col":1,"start_line":1}},{"artifact_digest":"a8cdd76642f0ecda0067f4d780d027935959e42dc16520220f295191b913efba","role":"supporting_context","semantic_id":"pen:root:1","source_id":"src:main","span":{"end":1,"end_col":2,"end_line":1,"start":0,"start_col":1,"start_line":1}},{"artifact_digest":"a8cdd76642f0ecda0067f4d780d027935959e42dc16520220f295191b913efba","role":"supporting_context","semantic_id":"r:root","source_id":"src:main","span":{"end":1,"end_col":2,"end_line":1,"start":0,"start_col":1,"start_line":1}},{"artifact_digest":"a8cdd76642f0ecda0067f4d780d027935959e42dc16520220f295191b913efba","role":"supporting_context","semantic_id":"term:fixture","source_id":"src:main","span":{"end":1,"end_col":2,"end_line":1,"start":0,"start_col":1,"start_line":1}}]}