{"artifacts":[{"byte_length":22,"media_type":"text/plain; charset=utf-8","role":"source_text","sha256":"6ce8ebf932c1eb5a739c4b2d7c9c5e836d01e60381acc469c10590bd38b884dd"},{"byte_length":1500,"media_type":"application/json","role":"executable_model","sha256":"7b507c2a83d4925366e4af296054fc357a6dfe0c2e75f727a5377f32e614c12d"}],"canonical_profile":"yuho.sorted-json/v1","derivations":[],"executable_model":{"artifact_digest":"7b507c2a83d4925366e4af296054fc357a6dfe0c2e75f727a5377f32e614c12d","format":"yuho.kernel-input/v1","fragment":"RegisteredPresumptionDerivations-v1"},"hash_algorithm":"sha256","legal_sources":[{"artifact_digest":"6ce8ebf932c1eb5a739c4b2d7c9c5e836d01e60381acc469c10590bd38b884dd","dates":{},"expression_id":"expression:synthetic:1","identifiers":[],"jurisdiction":"SYN","language":"en","locator":"fixture:synthetic:1","manifestation_id":"manifestation:text:1","publisher_label":"synthetic fixture author","source_id":"src:main","source_type":"synthetic","work_id":"work:synthetic"}],"model_id":"model:synthetic","schema":"yuho.model-bundle/v1","scope":{"coverage_mode":"enumerated_only","exclusions":[],"expression_ids":["expression:synthetic:1"],"jurisdictions":["SYN"],"limitations":["synthetic technical fixture"],"semantic_ids":["f:root","p:root","pen:root:1","r:root","term:fixture"],"source_ids":["src:main"],"subject_matters":["synthetic"],"temporal_context":{"kind":"unspecified"},"unsupported_capabilities":[]},"semantic_mappings":[{"artifact_digest":"6ce8ebf932c1eb5a739c4b2d7c9c5e836d01e60381acc469c10590bd38b884dd","role":"supporting_context","semantic_id":"f:root","source_id":"src:main","span":{"end":1,"end_col":2,"end_line":1,"start":0,"start_col":1,"start_line":1}},{"artifact_digest":"6ce8ebf932c1eb5a739c4b2d7c9c5e836d01e60381acc469c10590bd38b884dd","role":"supporting_context","semantic_id":"p:root","source_id":"src:main","span":{"end":1,"end_col":2,"end_line":1,"start":0,"start_col":1,"start_line":1}},{"artifact_digest":"6ce8ebf932c1eb5a739c4b2d7c9c5e836d01e60381acc469c10590bd38b884dd","role":"supporting_context","semantic_id":"pen:root:1","source_id":"src:main","span":{"end":1,"end_col":2,"end_line":1,"start":0,"start_col":1,"start_line":1}},{"artifact_digest":"6ce8ebf932c1eb5a739c4b2d7c9c5e836d01e60381acc469c10590bd38b884dd","role":"supporting_context","semantic_id":"r:root","source_id":"src:main","span":{"end":1,"end_col":2,"end_line":1,"start":0,"start_col":1,"start_line":1}},{"artifact_digest":"6ce8ebf932c1eb5a739c4b2d7c9c5e836d01e60381acc469c10590bd38b884dd","role":"supporting_context","semantic_id":"term:fixture","source_id":"src:main","span":{"end":1,"end_col":2,"end_line":1,"start":0,"start_col":1,"start_line":1}}]}